{
  "$schema": "https://boj.dev/schemas/cartridge/v1.json",
  "spdx": "PMPL-1.0-or-later",
  "copyright": "Copyright (c) 2026 Jonathan D.A. Jewell (hyperpolymath)",
  "name": "notifyhub-mcp",
  "version": "0.1.0",
  "description": "Unified notification platform. Send notifications via Email, SMS, WhatsApp, Slack, Telegram, Discord, Teams, Firebase Push, Webhooks, WebSocket, Google Chat, Twitter/X, LinkedIn, Notion, Twitch, YouTube, Instagram, SendGrid, TikTok Shop, Facebook, AWS SNS, Mailgun, PagerDuty, Kick.",
  "domain": "Communication",
  "tier": "Ayo",
  "protocols": [
    "MCP",
    "REST"
  ],
  "auth": {
    "method": "api-key",
    "env_var": "NOTIFYHUB_API_KEY",
    "credential_source": "user-provided"
  },
  "api": {
    "base_url": "local://notifyhub-mcp",
    "content_type": "application/json"
  },
  "ports": {
    "allowed": [8080, 443],
    "denied": [22, 23, 25, 135, 139, 445]
  },
  "tools": [
    {
      "name": "notifyhub_send_email",
      "description": "Send email via SMTP (Gmail, SES, Outlook, etc).",
      "inputSchema": {
        "type": "object",
        "properties": {
          "to": {
            "type": "string",
            "description": "Recipient email address"
          },
          "subject": {
            "type": "string",
            "description": "Email subject"
          },
          "body": {
            "type": "string",
            "description": "Email body (plain text or HTML)"
          },
          "template": {
            "type": "string",
            "description": "Mustache template name (optional)"
          },
          "params": {
            "type": "object",
            "description": "Template parameters (optional)"
          }
        },
        "required": ["to", "subject", "body"]
      }
    },
    {
      "name": "notifyhub_send_sms",
      "description": "Send SMS via Twilio.",
      "inputSchema": {
        "type": "object",
        "properties": {
          "phone": {
            "type": "string",
            "description": "Recipient phone number (E.164 format)"
          },
          "body": {
            "type": "string",
            "description": "SMS message content"
          }
        },
        "required": ["phone", "body"]
      }
    },
    {
      "name": "notifyhub_send_slack",
      "description": "Send message to Slack channel via webhook.",
      "inputSchema": {
        "type": "object",
        "properties": {
          "recipient": {
            "type": "string",
            "description": "Slack channel or named alias"
          },
          "body": {
            "type": "string",
            "description": "Message content"
          }
        },
        "required": ["recipient", "body"]
      }
    },
    {
      "name": "notifyhub_send_discord",
      "description": "Send message to Discord channel via webhook.",
      "inputSchema": {
        "type": "object",
        "properties": {
          "recipient": {
            "type": "string",
            "description": "Discord channel or named alias"
          },
          "body": {
            "type": "string",
            "description": "Message content"
          }
        },
        "required": ["recipient", "body"]
      }
    },
    {
      "name": "notifyhub_send_telegram",
      "description": "Send message via Telegram Bot API.",
      "inputSchema": {
        "type": "object",
        "properties": {
          "recipient": {
            "type": "string",
            "description": "Telegram chat ID or named alias"
          },
          "body": {
            "type": "string",
            "description": "Message content"
          }
        },
        "required": ["recipient", "body"]
      }
    }
  ]
}
