{
  "$schema": "https://boj.dev/schemas/cartridge/v1.json",
  "spdx": "PMPL-1.0-or-later",
  "copyright": "Copyright (c) 2026 Jonathan D.A. Jewell (hyperpolymath) <j.d.a.jewell@open.ac.uk>",
  "name": "linear-mcp",
  "version": "0.1.0",
  "description": "Linear issue tracking and project management",
  "domain": "project-management",
  "tier": "Ayo",
  "protocols": [
    "MCP",
    "REST"
  ],
  "auth": {
    "method": "none",
    "env_var": null,
    "credential_source": null
  },
  "api": {
    "base_url": "local://linear-mcp",
    "content_type": "application/json"
  },
  "tools": [
    {
      "name": "linear_authenticate",
      "description": "Authenticate with Linear API key",
      "inputSchema": {
        "type": "object",
        "properties": {
          "api_key": {
            "type": "string",
            "description": "Linear API key"
          }
        },
        "required": [
          "api_key"
        ]
      }
    },
    {
      "name": "linear_list_issues",
      "description": "List issues (optionally filtered)",
      "inputSchema": {
        "type": "object",
        "properties": {
          "session_id": {
            "type": "integer",
            "description": "Session index"
          },
          "team_id": {
            "type": "string",
            "description": "Team ID filter"
          },
          "state": {
            "type": "string",
            "description": "State filter"
          }
        },
        "required": [
          "session_id"
        ]
      }
    },
    {
      "name": "linear_get_issue",
      "description": "Get a specific issue",
      "inputSchema": {
        "type": "object",
        "properties": {
          "session_id": {
            "type": "integer",
            "description": "Session index"
          },
          "issue_id": {
            "type": "string",
            "description": "Issue ID"
          }
        },
        "required": [
          "session_id",
          "issue_id"
        ]
      }
    },
    {
      "name": "linear_create_issue",
      "description": "Create a new issue",
      "inputSchema": {
        "type": "object",
        "properties": {
          "session_id": {
            "type": "integer",
            "description": "Session index"
          },
          "team_id": {
            "type": "string",
            "description": "Team ID"
          },
          "title": {
            "type": "string",
            "description": "Issue title"
          },
          "description": {
            "type": "string",
            "description": "Issue description"
          },
          "priority": {
            "type": "integer",
            "description": "Priority 0-4"
          }
        },
        "required": [
          "session_id",
          "team_id",
          "title"
        ]
      }
    },
    {
      "name": "linear_update_issue",
      "description": "Update an issue",
      "inputSchema": {
        "type": "object",
        "properties": {
          "session_id": {
            "type": "integer",
            "description": "Session index"
          },
          "issue_id": {
            "type": "string",
            "description": "Issue ID"
          },
          "fields": {
            "type": "object",
            "description": "Fields to update"
          }
        },
        "required": [
          "session_id",
          "issue_id",
          "fields"
        ]
      }
    },
    {
      "name": "linear_list_teams",
      "description": "List teams in the workspace",
      "inputSchema": {
        "type": "object",
        "properties": {
          "session_id": {
            "type": "integer",
            "description": "Session index"
          }
        },
        "required": [
          "session_id"
        ]
      }
    },
    {
      "name": "linear_search_issues",
      "description": "Search issues by query",
      "inputSchema": {
        "type": "object",
        "properties": {
          "session_id": {
            "type": "integer",
            "description": "Session index"
          },
          "query": {
            "type": "string",
            "description": "Search query"
          }
        },
        "required": [
          "session_id",
          "query"
        ]
      }
    }
  ]
}
