{
  "$schema": "https://boj.dev/schemas/cartridge/v1.json",
  "spdx": "PMPL-1.0-or-later",
  "copyright": "Copyright (c) 2026 Jonathan D.A. Jewell (hyperpolymath) <j.d.a.jewell@open.ac.uk>",
  "name": "idaptik-admin-mcp",
  "version": "0.1.0",
  "description": "IDApTIK game server administration",
  "domain": "gaming",
  "tier": "Ayo",
  "protocols": [
    "MCP",
    "REST"
  ],
  "auth": {
    "method": "none",
    "env_var": null,
    "credential_source": null
  },
  "api": {
    "base_url": "local://idaptik-admin-mcp",
    "content_type": "application/json"
  },
  "tools": [
    {
      "name": "idaptik_server_status",
      "description": "Get IDApTIK server status",
      "inputSchema": {
        "type": "object",
        "properties": {}
      }
    },
    {
      "name": "idaptik_list_sessions",
      "description": "List active learner sessions",
      "inputSchema": {
        "type": "object",
        "properties": {}
      }
    },
    {
      "name": "idaptik_create_session",
      "description": "Create a new learner session",
      "inputSchema": {
        "type": "object",
        "properties": {
          "player_id": {
            "type": "string",
            "description": "Player identifier"
          },
          "level_pack": {
            "type": "string",
            "description": "Level pack name"
          }
        },
        "required": [
          "player_id"
        ]
      }
    },
    {
      "name": "idaptik_end_session",
      "description": "End a learner session",
      "inputSchema": {
        "type": "object",
        "properties": {
          "session_id": {
            "type": "string",
            "description": "Session ID"
          }
        },
        "required": [
          "session_id"
        ]
      }
    },
    {
      "name": "idaptik_get_config",
      "description": "Get server configuration",
      "inputSchema": {
        "type": "object",
        "properties": {}
      }
    },
    {
      "name": "idaptik_update_config",
      "description": "Update server configuration",
      "inputSchema": {
        "type": "object",
        "properties": {
          "config": {
            "type": "object",
            "description": "Configuration updates"
          }
        },
        "required": [
          "config"
        ]
      }
    },
    {
      "name": "idaptik_list_level_packs",
      "description": "List available level packs",
      "inputSchema": {
        "type": "object",
        "properties": {}
      }
    },
    {
      "name": "idaptik_toggle_training",
      "description": "Toggle training mode on/off",
      "inputSchema": {
        "type": "object",
        "properties": {
          "enabled": {
            "type": "boolean",
            "description": "Enable training mode"
          }
        },
        "required": [
          "enabled"
        ]
      }
    },
    {
      "name": "idaptik_player_stats",
      "description": "Get player statistics",
      "inputSchema": {
        "type": "object",
        "properties": {
          "player_id": {
            "type": "string",
            "description": "Player identifier"
          }
        },
        "required": [
          "player_id"
        ]
      }
    },
    {
      "name": "idaptik_server_action",
      "description": "Execute a server action",
      "inputSchema": {
        "type": "object",
        "properties": {
          "action": {
            "type": "string",
            "description": "Action: start|stop|restart|reload_packs"
          }
        },
        "required": [
          "action"
        ]
      }
    }
  ]
}
