{
  "$schema": "https://boj.dev/schemas/cartridge/v1.json",
  "spdx": "PMPL-1.0-or-later",
  "copyright": "Copyright (c) 2026 Jonathan D.A. Jewell (hyperpolymath)",
  "name": "origenemcp",
  "version": "0.1.0",
  "description": "Biomedical MCP Server Platform. Integrates 600+ tools and databases (ChEMBL, PubChem, FDA, OpenTargets, NCBI, UniProt, PDB, Ensembl, UCSC, KEGG, STRING, TCGA, Monarch, ClinicalTrials) for multi-dimensional biomedical information retrieval.",
  "domain": "Bioinformatics",
  "tier": "Ayo",
  "protocols": [
    "MCP",
    "REST"
  ],
  "auth": {
    "method": "api-key",
    "env_var": "ORIGENE_API_KEY",
    "credential_source": "user-provided"
  },
  "api": {
    "base_url": "local://origenemcp",
    "content_type": "application/json"
  },
  "ports": {
    "allowed": [8788],
    "denied": [22, 23, 25, 135, 139, 445]
  },
  "tools": [
    {
      "name": "origenemcp_get_gene_info",
      "description": "Get general information about a gene (e.g., TP53) from UniProt.",
      "inputSchema": {
        "type": "object",
        "properties": {
          "gene_name": {
            "type": "string",
            "description": "Name of the gene (e.g., TP53)"
          },
          "species": {
            "type": "string",
            "description": "Species name (e.g., Homo sapiens)"
          }
        },
        "required": ["gene_name"]
      }
    },
    {
      "name": "origenemcp_search_compound",
      "description": "Search for a compound in ChEMBL or PubChem.",
      "inputSchema": {
        "type": "object",
        "properties": {
          "compound_name": {
            "type": "string",
            "description": "Name or ID of the compound"
          },
          "database": {
            "type": "string",
            "enum": ["chembl", "pubchem"],
            "description": "Database to search (default: chembl)"
          }
        },
        "required": ["compound_name"]
      }
    },
    {
      "name": "origenemcp_get_disease_info",
      "description": "Get information about a disease from OpenTargets or Monarch.",
      "inputSchema": {
        "type": "object",
        "properties": {
          "disease_name": {
            "type": "string",
            "description": "Name of the disease"
          },
          "database": {
            "type": "string",
            "enum": ["opentargets", "monarch"],
            "description": "Database to search (default: opentargets)"
          }
        },
        "required": ["disease_name"]
      }
    },
    {
      "name": "origenemcp_search_clinical_trials",
      "description": "Search for clinical trials related to a disease or compound.",
      "inputSchema": {
        "type": "object",
        "properties": {
          "query": {
            "type": "string",
            "description": "Disease name, compound name, or other keywords"
          },
          "status": {
            "type": "string",
            "description": "Trial status (e.g., recruiting, completed)"
          }
        },
        "required": ["query"]
      }
    },
    {
      "name": "origenemcp_get_protein_structure",
      "description": "Get protein structure from PDB.",
      "inputSchema": {
        "type": "object",
        "properties": {
          "pdb_id": {
            "type": "string",
            "description": "PDB ID of the protein"
          }
        },
        "required": ["pdb_id"]
      }
    }
  ]
}
