{
  "$schema": "https://boj.dev/schemas/cartridge/v1.json",
  "spdx": "PMPL-1.0-or-later",
  "copyright": "Copyright (c) 2026 Jonathan D.A. Jewell (hyperpolymath)",
  "name": "matrix-mcp",
  "version": "0.1.0",
  "description": "Matrix homeserver gateway. Send messages, join/leave rooms, read room history, and manage membership.",
  "domain": "Communications",
  "tier": "Ayo",
  "protocols": [
    "MCP",
    "REST"
  ],
  "auth": {
    "method": "none",
    "env_var": null,
    "credential_source": null
  },
  "api": {
    "base_url": "local://matrix-mcp",
    "content_type": "application/json"
  },
  "tools": [
    {
      "name": "matrix_authenticate",
      "description": "Authenticate with a Matrix homeserver.",
      "inputSchema": {
        "type": "object",
        "properties": {
          "homeserver": {
            "type": "string",
            "description": "Matrix homeserver URL (https://matrix.example.org)"
          },
          "access_token": {
            "type": "string",
            "description": "Matrix access token"
          }
        },
        "required": [
          "homeserver",
          "access_token"
        ]
      }
    },
    {
      "name": "matrix_send_message",
      "description": "Send a message to a Matrix room.",
      "inputSchema": {
        "type": "object",
        "properties": {
          "slot": {
            "type": "integer",
            "description": "Session slot from matrix_authenticate"
          },
          "room_id": {
            "type": "string",
            "description": "Matrix room ID (!abc:example.org)"
          },
          "body": {
            "type": "string",
            "description": "Message body"
          },
          "msgtype": {
            "type": "string",
            "description": "Message type: m.text (default) or m.notice"
          }
        },
        "required": [
          "slot",
          "room_id",
          "body"
        ]
      }
    },
    {
      "name": "matrix_list_rooms",
      "description": "List rooms the user is a member of.",
      "inputSchema": {
        "type": "object",
        "properties": {
          "slot": {
            "type": "integer",
            "description": "Session slot"
          }
        },
        "required": [
          "slot"
        ]
      }
    },
    {
      "name": "matrix_get_messages",
      "description": "Get recent messages from a room.",
      "inputSchema": {
        "type": "object",
        "properties": {
          "slot": {
            "type": "integer",
            "description": "Session slot"
          },
          "room_id": {
            "type": "string",
            "description": "Room ID"
          },
          "limit": {
            "type": "integer",
            "description": "Number of messages (default: 50)"
          }
        },
        "required": [
          "slot",
          "room_id"
        ]
      }
    },
    {
      "name": "matrix_join_room",
      "description": "Join a Matrix room by ID or alias.",
      "inputSchema": {
        "type": "object",
        "properties": {
          "slot": {
            "type": "integer",
            "description": "Session slot"
          },
          "room_id": {
            "type": "string",
            "description": "Room ID or alias"
          }
        },
        "required": [
          "slot",
          "room_id"
        ]
      }
    },
    {
      "name": "matrix_leave_room",
      "description": "Leave a Matrix room.",
      "inputSchema": {
        "type": "object",
        "properties": {
          "slot": {
            "type": "integer",
            "description": "Session slot"
          },
          "room_id": {
            "type": "string",
            "description": "Room ID"
          }
        },
        "required": [
          "slot",
          "room_id"
        ]
      }
    },
    {
      "name": "matrix_deauthenticate",
      "description": "Release a Matrix session slot.",
      "inputSchema": {
        "type": "object",
        "properties": {
          "slot": {
            "type": "integer",
            "description": "Session slot to release"
          }
        },
        "required": [
          "slot"
        ]
      }
    }
  ]
}
