{
  "$schema": "https://boj.dev/schemas/cartridge/v1.json",
  "spdx": "PMPL-1.0-or-later",
  "copyright": "Copyright (c) 2026 Jonathan D.A. Jewell (hyperpolymath) <j.d.a.jewell@open.ac.uk>",
  "name": "game-admin-mcp",
  "version": "0.1.0",
  "description": "Game server administration and configuration drift",
  "domain": "gaming",
  "tier": "Ayo",
  "protocols": [
    "MCP",
    "REST"
  ],
  "auth": {
    "method": "none",
    "env_var": null,
    "credential_source": null
  },
  "api": {
    "base_url": "local://game-admin-mcp",
    "content_type": "application/json"
  },
  "tools": [
    {
      "name": "game_probe_server",
      "description": "Probe a game server for status",
      "inputSchema": {
        "type": "object",
        "properties": {
          "host": {
            "type": "string",
            "description": "Server host"
          },
          "port": {
            "type": "integer",
            "description": "Server port"
          }
        },
        "required": [
          "host"
        ]
      }
    },
    {
      "name": "game_list_servers",
      "description": "List known game servers",
      "inputSchema": {
        "type": "object",
        "properties": {}
      }
    },
    {
      "name": "game_get_config",
      "description": "Get game server configuration",
      "inputSchema": {
        "type": "object",
        "properties": {
          "server_id": {
            "type": "string",
            "description": "Server ID"
          }
        },
        "required": [
          "server_id"
        ]
      }
    },
    {
      "name": "game_set_config",
      "description": "Set game server configuration",
      "inputSchema": {
        "type": "object",
        "properties": {
          "server_id": {
            "type": "string",
            "description": "Server ID"
          },
          "config": {
            "type": "object",
            "description": "Configuration object"
          }
        },
        "required": [
          "server_id",
          "config"
        ]
      }
    },
    {
      "name": "game_server_action",
      "description": "Execute a server action",
      "inputSchema": {
        "type": "object",
        "properties": {
          "server_id": {
            "type": "string",
            "description": "Server ID"
          },
          "action": {
            "type": "string",
            "description": "Action: start|stop|restart|reload"
          }
        },
        "required": [
          "server_id",
          "action"
        ]
      }
    },
    {
      "name": "game_drift_status",
      "description": "Check configuration drift across servers",
      "inputSchema": {
        "type": "object",
        "properties": {}
      }
    },
    {
      "name": "game_list_profiles",
      "description": "List server configuration profiles",
      "inputSchema": {
        "type": "object",
        "properties": {}
      }
    }
  ]
}
