{
  "$schema": "https://boj.dev/schemas/cartridge/v1.json",
  "spdx": "PMPL-1.0-or-later",
  "copyright": "Copyright (c) 2026 Jonathan D.A. Jewell (hyperpolymath) <j.d.a.jewell@open.ac.uk>",
  "name": "dns-shield-mcp",
  "version": "0.1.0",
  "description": "DNS security shield \u2014 DoQ, DoH, DNSSEC, CAA",
  "domain": "security",
  "tier": "Ayo",
  "protocols": [
    "MCP",
    "REST"
  ],
  "auth": {
    "method": "none",
    "env_var": null,
    "credential_source": null
  },
  "api": {
    "base_url": "local://dns-shield-mcp",
    "content_type": "application/json"
  },
  "tools": [
    {
      "name": "dns_resolve_doq",
      "description": "Resolve domain via DNS-over-QUIC (encrypted)",
      "inputSchema": {
        "type": "object",
        "properties": {
          "domain": {
            "type": "string",
            "description": "Domain name to resolve"
          },
          "record_type": {
            "type": "string",
            "description": "Record type: A|AAAA|MX|TXT|CNAME"
          }
        },
        "required": [
          "domain"
        ]
      }
    },
    {
      "name": "dns_resolve_doh",
      "description": "Resolve domain via DNS-over-HTTPS (encrypted)",
      "inputSchema": {
        "type": "object",
        "properties": {
          "domain": {
            "type": "string",
            "description": "Domain name to resolve"
          },
          "record_type": {
            "type": "string",
            "description": "Record type: A|AAAA|MX|TXT|CNAME"
          }
        },
        "required": [
          "domain"
        ]
      }
    },
    {
      "name": "dns_check_caa",
      "description": "Check CAA records for CA authorization",
      "inputSchema": {
        "type": "object",
        "properties": {
          "domain": {
            "type": "string",
            "description": "Domain name"
          }
        },
        "required": [
          "domain"
        ]
      }
    },
    {
      "name": "dns_validate_dnssec",
      "description": "Validate DNSSEC chain for a domain",
      "inputSchema": {
        "type": "object",
        "properties": {
          "domain": {
            "type": "string",
            "description": "Domain name"
          }
        },
        "required": [
          "domain"
        ]
      }
    },
    {
      "name": "dns_flush_cache",
      "description": "Flush DNS resolver cache",
      "inputSchema": {
        "type": "object",
        "properties": {
          "domain": {
            "type": "string",
            "description": "Domain to flush, or * for all"
          }
        }
      }
    }
  ]
}
