{
  "$schema": "https://boj.dev/schemas/cartridge/v1.json",
  "spdx": "PMPL-1.0-or-later",
  "copyright": "Copyright (c) 2026 Jonathan D.A. Jewell (hyperpolymath) <j.d.a.jewell@open.ac.uk>",
  "name": "observe-mcp",
  "version": "0.1.0",
  "description": "Unified observability \u2014 metrics, logs, traces (Prometheus, Grafana, Loki, Jaeger)",
  "domain": "observability",
  "tier": "Ayo",
  "protocols": [
    "MCP",
    "REST"
  ],
  "auth": {
    "method": "none",
    "env_var": null,
    "credential_source": null
  },
  "api": {
    "base_url": "local://observe-mcp",
    "content_type": "application/json"
  },
  "tools": [
    {
      "name": "observe_register",
      "description": "Register an observability backend",
      "inputSchema": {
        "type": "object",
        "properties": {
          "backend": {
            "type": "string",
            "description": "Backend: prometheus|grafana|loki|jaeger"
          },
          "endpoint": {
            "type": "string",
            "description": "Backend endpoint URL"
          }
        },
        "required": [
          "backend",
          "endpoint"
        ]
      }
    },
    {
      "name": "observe_query_metrics",
      "description": "Query metrics (PromQL)",
      "inputSchema": {
        "type": "object",
        "properties": {
          "session_id": {
            "type": "integer",
            "description": "Session index"
          },
          "query": {
            "type": "string",
            "description": "PromQL query"
          },
          "start": {
            "type": "string",
            "description": "Start time (RFC3339 or relative)"
          },
          "end": {
            "type": "string",
            "description": "End time"
          }
        },
        "required": [
          "session_id",
          "query"
        ]
      }
    },
    {
      "name": "observe_query_logs",
      "description": "Query logs (LogQL)",
      "inputSchema": {
        "type": "object",
        "properties": {
          "session_id": {
            "type": "integer",
            "description": "Session index"
          },
          "query": {
            "type": "string",
            "description": "LogQL query"
          },
          "limit": {
            "type": "integer",
            "description": "Max log lines"
          }
        },
        "required": [
          "session_id",
          "query"
        ]
      }
    },
    {
      "name": "observe_query_traces",
      "description": "Query traces by service or trace ID",
      "inputSchema": {
        "type": "object",
        "properties": {
          "session_id": {
            "type": "integer",
            "description": "Session index"
          },
          "service": {
            "type": "string",
            "description": "Service name"
          },
          "trace_id": {
            "type": "string",
            "description": "Trace ID"
          }
        },
        "required": [
          "session_id"
        ]
      }
    }
  ]
}
