{
  "$schema": "https://boj.dev/schemas/cartridge/v1.json",
  "spdx": "PMPL-1.0-or-later",
  "copyright": "Copyright (c) 2026 Jonathan D.A. Jewell (hyperpolymath) <j.d.a.jewell@open.ac.uk>",
  "name": "civic-connect-mcp",
  "version": "0.1.0",
  "description": "CivicConnect community engagement platform",
  "domain": "community",
  "tier": "Ayo",
  "protocols": [
    "MCP",
    "REST"
  ],
  "auth": {
    "method": "none",
    "env_var": null,
    "credential_source": null
  },
  "api": {
    "base_url": "local://civic-connect-mcp",
    "content_type": "application/json"
  },
  "tools": [
    {
      "name": "civic_list_channels",
      "description": "List available community channels",
      "inputSchema": {
        "type": "object",
        "properties": {}
      }
    },
    {
      "name": "civic_send_message",
      "description": "Send a message to a channel",
      "inputSchema": {
        "type": "object",
        "properties": {
          "channel_id": {
            "type": "integer",
            "description": "Channel ID"
          },
          "body": {
            "type": "string",
            "description": "Message body"
          }
        },
        "required": [
          "channel_id",
          "body"
        ]
      }
    },
    {
      "name": "civic_get_poll",
      "description": "Get a community poll",
      "inputSchema": {
        "type": "object",
        "properties": {
          "poll_id": {
            "type": "integer",
            "description": "Poll ID"
          }
        },
        "required": [
          "poll_id"
        ]
      }
    }
  ]
}
